{
  "$schema": "http://json-schema.org/draft-07/schema#",
  "title": "DryRunResult",
  "description": "Top-level dry-run result.",
  "type": "object",
  "properties": {
    "dryRunResultID": {
      "type": "string"
    },
    "wouldMutate": {
      "type": "boolean"
    },
    "recoveryPlan": {
      "$ref": "RecoveryPlan.schema.json"
    },
    "verificationPlan": {
      "$ref": "VerificationPlan.schema.json"
    },
    "diagnosticChain": {
      "$ref": "DiagnosticChain.schema.json"
    }
  },
  "required": [
    "dryRunResultID",
    "wouldMutate",
    "recoveryPlan",
    "verificationPlan",
    "diagnosticChain"
  ],
  "additionalProperties": false
}
