{
  "dryRunResultID": "example",
  "wouldMutate": true,
  "recoveryPlan": {
    "recoveryPlanID": "example",
    "planDisposition": "NO_ACTION",
    "diagnosticReference": {
      "diagnosticID": "example",
      "chainRootReference": "example",
      "diagnosticKind": "STATE_VALIDITY",
      "ruleReferences": [
        {
          "ruleID": "ASH-STATE-VALIDITY-001",
          "sourceReference": "example",
          "ruleFamily": "example"
        }
      ]
    },
    "stateClass": "STABLE",
    "recoveryCategory": "NO_ACTION",
    "requiresPolicyGate": true,
    "requiresBackup": true,
    "recoverySteps": [],
    "planHash": "example",
    "createdAt": "example"
  },
  "verificationPlan": {
    "verificationPlanID": "example",
    "checks": [
      {}
    ],
    "expectedSemanticState": {
      "stateID": "example",
      "coordinates": [
        0,
        0,
        0,
        0,
        0,
        0,
        0,
        0,
        0
      ],
      "sourceReference": "example",
      "canonicalHash": "example"
    },
    "generatedBeforeMutation": true,
    "diagnosticReference": {
      "diagnosticID": "example",
      "chainRootReference": "example",
      "diagnosticKind": "STATE_VALIDITY",
      "ruleReferences": [
        {
          "ruleID": "ASH-STATE-VALIDITY-001",
          "sourceReference": "example",
          "ruleFamily": "example"
        }
      ]
    }
  },
  "diagnosticChain": {
    "chainID": "example",
    "rootDiagnosticID": "example",
    "diagnostics": [
      {
        "diagnosticID": "example",
        "chainRootReference": "example",
        "parentDiagnosticID": "example",
        "diagnosticKind": "STATE_VALIDITY",
        "severity": "INFO",
        "message": "example",
        "ruleReferences": [
          {
            "ruleID": "ASH-STATE-VALIDITY-001",
            "sourceReference": "example",
            "ruleFamily": "example"
          }
        ],
        "sourceReferences": [
          "example"
        ],
        "evidence": {}
      }
    ]
  }
}
